[
  {
    "step": 0,
    "timestamp": "2026-07-01T00:00:00Z",
    "visible_info": "TODO: describe the earliest observable event from the OpenAI incident report / HF documentation.",
    "ground_truth_label": "benign"
  },
  {
    "step": 1,
    "timestamp": "2026-07-01T00:00:00Z",
    "visible_info": "TODO",
    "ground_truth_label": "unsafe"
  }
]
